{
  "schema_version": 1,
  "id": "HARNESS-SMOKE",
  "wiki_task_id": "RLAB-TASK-0008",
  "goal_id": "goal-harness-smoke",
  "milestone_id": "milestone-harness-smoke",
  "title": "隔離 Harness smoke fixture",
  "objective": "在指定隔離工作區建立 answer.mjs，export const answer=42；保留既有部分實作。這是 Harness fixture，不是正式產品功能。",
  "scope": ["answer.mjs"],
  "out_of_scope": ["正式產品功能", "付費模型呼叫", "修改驗收檔案"],
  "allowed_files": ["answer.mjs"],
  "acceptance": [{ "id": "AC-ANSWER", "script": "examples/agents/acceptance.mjs", "args": [] }],
  "protected_files": ["examples/agents/acceptance.mjs"],
  "muse": { "model": "muse-spark-1.3", "reasoning_effort": "medium" },
  "policy": {
    "max_attempts": 8,
    "max_repairs": 3,
    "max_rate_retries": 2,
    "max_elapsed_ms": 300000,
    "timeout_ms": 5000,
    "development": { "max_paid_usd": 0, "max_model_steps": 30 },
    "product_runtime": { "max_paid_usd": 0 }
  }
}
